,タイトル,説明
I-01,竹林院群芳園にようこそ,竹林院群芳園は、桜の名所、奈良県吉野山に位置する、大和三庭園のひとつとして知られた回遊式庭園です。元は聖徳太子が開創したとされる修験道系統の単立寺院「椿山寺」。竹林院は、格調高い宿坊としても有名で、四季折々の美しい自然をお楽しみいただけます。
I-02,ココニワプロジェクトとは,奈良県立磯城野高等学校と東京工芸大学が、奈良県教育委員会の協力の下、奈良の庭園をより深く楽しめる観光アプリ“ココニワ”を開発し配信するプロジェクトです。“ココニワ”は、取材・コンテンツ制作・プログラミングを高校生と大学生で行い制作する若い人目線のアプリ、庭園内の木札をAR機能で認識してコンテンツをご覧いただけます。
I-03,磯城野高等学校について,奈良県立磯城野高等学校は、人と自然を環境の視点から学び、科学技術の進展や産業社会の発展に、主体的・創造的に貢献できるスペシャリストの育成を目指す実践的体験型の専門高校です。農業系の４学科（８コース）と家庭系３学科（うち１学科に２コース）で少人数指導による専門教育を行なっています。
I-04,東京工芸大学について,東京工芸大学は工学部と芸術学部という非常にユニークな学部構成の大学です。工学部では先端テクノロジーを、芸術学部ではメディアアートと呼ばれる分野の勉強をすることができ、技術と創造性を用いて新しい価値を生み出し、社会のために活躍できる人材を多く育成しています。
I-05,せんとくんについて,奈良県のマスコットキャラクターせんとくんは、平成20年2月12日生まれの伸び盛りで元気いっぱいな男の子。温故知新を地で行く好奇心旺盛なやんちゃな子でダンスが得意！そして、奈良のうまいものが大好き！「ココニワ」では、奈良県の高校生と一緒に奈良の美しい庭園をみなさんにご案内します！
H-01,聖徳太子,竹林院の歴史は聖徳太子の時代にまでさかのぼります。寺伝によれば、聖徳太子が開創して常楽山椿山寺(ちんざんじ)と号し、1385年（至徳2年/元中2年）南北朝時代最後の天皇である後小松天皇の時代に竹林院と改められました。
H-02,千利休,戦国時代から安土桃山時代にかけての茶人で、わび茶の完成者として知られ、茶聖とも称せられています。利休流茶道の祖。織田信長・豊臣秀吉の茶頭となり、豊臣秀吉の吉野の桜の花見(1594)に際して、群芳園を修築したといわれています。
H-03,細川幽斎,細川幽斎は、戦国時代から江戸時代初期にかけての武将、大名、歌人として知られています。室町幕府13代将軍足利義輝に仕え、その後、足利義昭、織田信長、豊臣秀吉、徳川家康に仕え、近世大名肥後細川家の礎となりました。竹林院の庭園は、秀吉の観桜の前に細川幽斎が改築したと言われています。
H-04,空海,弘法大師・空海（７７４～８３５年）の「性霊集」のなかに「吉野から南へ1日、西へ2日行きて幽遠の地を見つける。名付けて高野をいう」と、吉野から高野山に至る文章があります。その際に竹林院にも立ち寄ったと伝えらています。金剛峯寺は高野山真言宗の総本山、金峯山寺は金峯山修験本宗の総本山で、いずれも国内を代表する山岳寺院として知られています。
H-05,神仏習合,画像は、金峯山寺銅鳥居（かねのとりい）です。聖武天皇の東大寺大仏殿建立の余銅で建設されたと伝えられ、1711年に再興されたと記録されている現存最古の銅製の鳥居です。1868年神仏分離令が出され、神道と仏教が分けられるまでは、「鳥居は神社」「仁王門はお寺」という区別がありませんでした。
H-06,役行者,役行者(えんのぎょうじゃ)とは奈良時代に活躍したとされる伝説的な修行者。奈良県御所市の生まれで、日本独自の山岳宗教である修験道の開祖としても知られます。役行者は吉野の山中に籠り、厳しい修行の末「蔵王権現(ざおうごんげん)」の姿を感得。その後、蔵王権現を桜の木に彫り金峯山寺の本尊として祀ったことから、吉野山では桜がご神木として手厚く保護されるようになりました。
H-07,山伏,山伏は、山岳が持つ自然の霊力を身に付けることを目的とし、奈良山地の大峰山を代表に日本各地の霊山と呼ばれる山々を踏破し厳しい修行を行います。秀吉が花見のため入山した際３日間雨が続きました。山伏が晴天祈願を行なったところ、次の日は晴れ満開の桜をご覧になったと伝えられています。
H-08,修験道,日本古来の山岳信仰に、神道や外来思想の仏教・道教などが混合して成立した、我が国独特の民族宗教であると位置づけられています。修行得験とか実修実験とか表現されるように、深山幽谷に分け入って、命がけの修行を行います。
H-09,秀吉の花見,吉野山は、古来より修験道に努める山伏の宿坊として利用されていました。豊臣秀吉は、絶頂の勢力を誇った文禄３（１５９４）年、徳川家康、宇喜多秀家、前田利家、伊達政宗らそうそうたる武将をはじめ、茶人、連歌師たちを伴い、総勢５千人で吉野山を訪れ大観桜を行いました。 その様子が、豊公吉野花見図屛風（細見美術館所蔵）に描かれています。
H-10,豊臣秀吉,1594年秀吉は吉野観桜の際に百双の屏風（豊太閤桃山百双）を持ってきて、その半分を吉野山に置いて帰ったとされています。その屏風の一部が竹林院（狩野元信作「夏冬芭蕉」）、吉水神社（狩野山雪作「竹の図」、狩野永徳作「桜の図」）に所蔵されています。また、竹林院には、その時使用した弁当箱も所蔵されています。
H-11,後醍醐天皇,足利尊氏に渡した三種の神器は贋物であるとして後醍醐天皇は奈良県吉野で、吉野朝廷（南朝）を開き、京都朝廷（北朝）と並立する南北朝時代がはじまりました。その後、京都奪回の遺言を残し崩御、如意輪寺の裏山に埋葬されました。その墓陵は、京都に帰る願いを表すため北向きとなっています。
H-12,与謝野晶子,「山の鳥竹林院の林泉を　楽しむ朝になりにけるかも」与謝野晶子は明治４４年に竹林院に宿泊、後に昭和２年には夫である与謝野鉄幹とともに竹林院を訪れています。この時に読まれた歌が境内の岩に刻まれています。
H-13,正岡子規,「柿くへば鐘が鳴るなり法隆寺」正岡子規の明治28年奈良吟行の句です。子規は吉野に関心を寄せていました。ですが、当時の交通事情や、自身の病状から法隆寺の帰途に吉野を訪れる余裕はありませんでした。ある人の吉野紀行を読んだ感興十三句を詠んで、そのうちの十句を発表しています。
H-14,源義経,吉野は、兄の源頼朝に追われることになった源義経が、弁慶や静御前と共に、身を隠していた場所です。吉野山には、義経や静御前に縁のある神社があり、吉水神社には、義経の鎧（よろい）や静御前の着物のほか、後醍醐天皇や豊臣秀吉にゆかりのある品が展示されています。
H-15,静御前,「吉野山 峯の白雪踏み分けて 入りにし人の 跡ぞ恋しき」吉野の山中で、静御前は捕まり鎌倉に送られ、その後、二人は二度と会うことはなかったと伝えられています。鎌倉に送られた後、兄の頼朝の前で、義経を慕う歌を唄い、頼朝の怒りをかいました。吉野山は、義経と静御前の悲恋の物語のゆかりの地です。
H-16,天武天皇,壬申の乱は、672年に起こった古代日本最大の内乱です。660年代後半、大海人皇子は自ら出家を申し出、吉野宮に下りました。672年天武天皇が崩御し、大友皇子が後を継ぎますが、大海人皇子は吉野を出立しました。瀬田橋の戦いで近江朝廷軍が大敗すると乱は収束、673年大海人皇子は飛鳥浄御原宮を造って即位しました。再び都は飛鳥（奈良県）に移されることになりました。
H-17,コノハナサクヤヒメ,天孫降臨を果たしたニニギノ命に見初められたコノハナサクヤヒメの名にある「木の花」とは桜以外には考えられないと古典学者の先生方の通説になっています。このことから、日本人の桜好みは日本国の始まりと同時期に出来上がったと考えられます。日本人は、可憐で美しく、力強い生命力のある桜が大好きなんです。
N-01,コイ,黄河の上流にある滝、竜門を登ることのできた鯉は竜になれるという言い伝えがあります。このことを鯉の滝登りといい、転じて立身出世のための関門を登竜門といいます。吉野にも「竜門」という地名が残っています
N-02,ムササビ,ムササビは日本にしか生息していない国有種です。おもに、本州、四国、九州に生息していましたが乱獲され、現在は数が減ってしまいました。竹林院の屋根裏にはムササビが住み着いているとか、運が良ければムササビに会えるかもしれませんね。
N-03,カモシカ,国の天然記念物。シカの名が入っていますが、シカ科ではなく、ウシやヤギと同じウシ科です。ウシ科であるためカモシカの角は骨が変化して出来たものであり、枝分かれしたり毎年生え変わったりしません。竹林院のカモシカの湯にはカモシカの石像が展示されています。吉野にはニホンカモシカが生息しています。
N-04,カラス,八咫烏（やたがらす）は、一般的に３本足のカラスとしてよく知られていますが、神武天皇を熊野国から大和国（奈良県橿原市）まで道案内したカラスです。また、桜の実を食べたカラスが桜の種が入った糞をして種を運んでいます。このことが、桜の繁殖につながっています。
N-05,ウソ,スズメ目アトリ科ウソ属に分類される鳥類です。名前の由来は口笛を意味する古語「うそ」、ヒーホーと口笛のような鳴き声から名付けられたました。ウソは、とまれない枝先を除く、ほぼ全ての桜の花芽を食害します。ウソの食害を受けると開花期になっても花が咲かないため鑑賞性が著しく低下します。
N-06,ツバキ,ツバキは古くから庭木として親しまれる日本を代表する花木のひとつです。名前の由来は、葉が丈夫なことから「強葉木」や葉に艶があることから「艶葉木」となった説など様々。この竹林院群方園内では唐椿やこしみの椿も見られることで有名です。花言葉は赤は「控え目な愛」「気取らない美しさ」白は「申し分のない愛らしさ」「理想的な愛情」「冷ややかな美しさ」です。
N-07,フジ,フジは、マメ科フジ属のつる性落葉木本。つるが右巻きと左巻きの二種類があり、右巻きの藤の標準和名は「フジ」または「ノダフジ」、左巻きの藤の標準和名は「ヤマフジ」または「ノフジ」といいます。日本古来の花木で、古くから鑑賞用として栽培され園芸品種も多いです。周囲の樹木に巻き付きながらたくましく成長していく生命力の強い植物です。
N-08,サルスベリ,サルスベリは夏を代表する花木の一つです。樹皮の剥がれた部分はつるつるしていて、「猿も木から落ちる→猿滑り」というのが名前の由来とされています。漢字では「百日紅」と書きます。これは、開花期間が長いとこところにちなんで当てられた漢字です。
N-09,シャクナゲ,ツツジ科ツツジ属の低木です。派手で大きな花に特徴があり、花の色は白あるいは赤系統、黄色のものがあります。シャクナゲは常緑広葉樹にもかかわらず寒冷地にまで分布しています。園芸用品種として数多くの外国産のシャクナゲが日本に導入されており、各地で植栽されています。
N-10,モミジ,モミジにはイロハモミジ、オオモミジ、ヤマモミジがあり、秋には美しく紅葉します。その違いは、葉のギザギザや葉柄の長さで区別することができます。イロハモミジは、日本庭園によく植栽されるムクロジ科カエデ属の落葉高木です。
N-11,バショウ,バショウは英名でジャパニーズバナナとも呼ばれバナナと同じバショウ科の多年草です。寒さに強い植物でその果実は種子が多く食用には適していません。庭の観賞用として古くから植えられ、竹林院に展示保管されている豊臣秀吉が吉野で大花見をした際に持って来た屏風の絵にも描かれています。
N-12,アジサイ,アジサイ科アジサイ属の落葉低木の一種で6月から7月にかけて開花し、白、青、紫または赤色の萼（がく）が大きく発達した装飾花をもちます。アジサイは土壌のpH（酸性度）によって花の色が変わり、一般に「酸性ならば青、アルカリ性ならば赤」になると言われていなす。毎年6月頃に吉野山であじさいまつりが開催されます。
N-13,吉野の桜,吉野の桜の由来は修験道の開祖、役行者が修行によって日本独自の仏である金剛蔵王権現を感得した時、その姿をヤマザクラの木で刻みお祀りしたことに始まるといわれています。以来、花見のためにではなく、蔵王権現や役行者に対する信仰の証として信者たちによって献木として植え続けられ、現在の桜の吉野山ができたと言われています。
N-14,全国桜サミット,桜による町づくりを推進する自治体が一堂に会して、共通の課題について討議し、加盟自治体の連携促進を図るため開催する「さくらサミット」は、吉野で２回開かれました。吉野は長年に渡りさくらサミットの活動に協力しています。
Y-01,大和三名園,奈良県内にある竹林院、慈光院、當麻寺中之坊庭園は、古くから大和三名園に数えられています。竹林院は、吉野山にある池泉回遊式の借景庭園、慈光院は大和郡山市にある借景庭園、當麻寺中之坊庭園は葛城市にある池泉回遊式庭園です。
Y-02,借景,借景とは、庭園外の山や森林などの自然物等の風景を庭園内の背景として取り込む日本庭園の形式のひとつです。前景の庭園と借景とを一体化させて景観を形成する手法で、竹林院は、大峰山を中心とした吉野の風景を表現しています。
Y-03,回遊式庭園,回遊式庭園とは、日本庭園の形式のひとつで、園内を回遊して鑑賞する庭園です。大きな池を中心に配し、周囲に園路を巡らして、築山、島、橋などで各地の景勝などを再現しています。園路の所々には、散策中の休憩所として、また、庭園を眺望する展望所として、茶亭、東屋などが設けられます。
Y-04,二重護岸の石組み,この庭園は、手前に出島、左の角に滝が造られ、二重護岸の石組みといった室町時代の庭園の特徴をそのまま残しています。蓬莱石組は、中国の道教、神仙思想からきたもので、桃山時代の作風です。
Y-05,天人之桜,樹齢300年の枝垂れ桜と伝えられています。うす紅のしだれ彼岸桜で紅と白の中間の花が咲きます。吉野山内では最も長寿の老木ともいわれ、合体木であると考えられています。豊臣秀吉が吉野山のお花見の際に植えられたとも言われる名桜です。
Y-06,椿山寺（ちんざんじ）,竹林院は、常楽山椿山寺(ちんざんじ)と号し開創されました。室町時代の末ごろ第21代住職祐尊が大峰山にも竹林院を建て、山上の様子を下院に移して庭園を築造しました。竹林院の庭園には、いろいろな種類の椿が植栽されています。
Y-07,宿坊,竹林院は、古くから山伏が宿泊する宿坊として栄えていました。明治時代、神仏分離令は各地で激しい廃仏毀釈に発展し日本の寺院の約半数が廃絶されたとされています。竹林院は、宿坊から旅館に姿を変えることで多くの文化財を守りました。
Y-08,金峰山寺,大峯山山上ケ岳に役行者が修行に入り、修験道独特の本尊・金剛蔵王大権現を感得し、この姿を山桜に刻んで、山上ケ岳と山麓の吉野山に祭祀されました。これが金峯山寺の開創と伝えられています。明治７年、明治政府により修験道が禁止され、金峯山寺は一時期、廃寺となり復職神勤しますが、同19年に仏寺として復興しました。
Y-09,大峰山,大峰山は1936年に吉野熊野国立公園に指定されました。しかし、ここは女性の立ち入りが認められていない、世界でも類を見ない珍しい場所です。その事から「男尊女卑を肯定する象徴」として多くの物議が繰り返されてきましたが、現在もなお宗教的理由から女性の立ち入りは認められていません。
Y-12,柿の葉寿司,柿の葉寿司とは海の幸と山の幸が出会ってできた郷土のすしです。柿の葉寿司のはじまりは酢を使わずに発酵させて酸味をつくるすしでした。浜塩をした鯖を薄くそぎ、ご飯を大きく握ったものを抱かせ、当時、どの家にも植えられていた渋柿の初夏の青々とした葉で包んでいたそうです。
Y-14,護摩堂,庭園に入り、正面に建つ護摩堂には、本尊である木造不動明王、蔵王権現、役行者像が安置されています。また、同じく、護摩堂に安置されている聖徳太子坐像は南北朝時代の作です。護摩堂の手前には大錫杖が置かれています。
Y-16,世界遺産,平成16年「紀伊山地の霊場と参詣道」の一つとして吉野・大峰エリアで大峰山寺本堂、金峯山寺銅鳥居、金峯山寺本堂、金峯山寺仁王門、吉水神社書院、吉野水分神社がユネスコの世界文化遺産に登録されました。
Y-17,吉野建,吉野は平地が少ないため、斜面に谷を背にして家屋を立てることが多くあります。表から見ると平屋か２階建てに見えますが、下方へ２階、３階になり、家族専用の空間として利用されます。この吉野建（よしのだて）と呼ばれる建築様式が吉野の独特な景観を生み出しています。
